{
  "version": "v12",
  "note": "Spot/chip and retail/product prices are intentionally separated. Current values are manual/public-anchor placeholders until paid/original series are inserted.",
  "charts": {
    "chip": {
      "title": "차트 1 · 칩 현물가: DDR4 / DDR5 / NAND MLC",
      "subtitle": "y축은 시작값 보정 없는 달러 가격입니다. DDR4·DDR5는 USD/chip, NAND MLC는 512Gb급 USD 추적값입니다.",
      "unitMode": "price",
      "axisUnit": "USD",
      "series": [
        {
          "id": "ddr4-16g",
          "name": "DDR4 16Gb 2Gx8 spot",
          "unit": "USD/chip",
          "color": "#007aff",
          "quality": "공개 기사 앵커 + 보간",
          "points": [
            [
              "2025-04",
              3.2
            ],
            [
              "2025-05",
              4.8
            ],
            [
              "2025-06",
              6.9
            ],
            [
              "2025-07",
              8.6
            ],
            [
              "2025-08",
              9.17
            ],
            [
              "2025-09",
              12.5
            ],
            [
              "2025-10",
              24.0
            ],
            [
              "2025-11",
              38.0
            ],
            [
              "2025-12",
              52.0
            ],
            [
              "2026-01",
              66.0
            ],
            [
              "2026-02",
              78.1
            ],
            [
              "2026-03",
              78.0
            ],
            [
              "2026-04",
              74.1
            ]
          ]
        },
        {
          "id": "ddr5-16g",
          "name": "DDR5 16Gb 2Gx8 spot",
          "unit": "USD/chip",
          "color": "#5856d6",
          "quality": "공개 기사 앵커 + 보간",
          "points": [
            [
              "2025-04",
              5.2
            ],
            [
              "2025-05",
              5.35
            ],
            [
              "2025-06",
              5.5
            ],
            [
              "2025-07",
              5.72
            ],
            [
              "2025-08",
              5.99
            ],
            [
              "2025-09",
              6.84
            ],
            [
              "2025-10",
              11.5
            ],
            [
              "2025-11",
              18.0
            ],
            [
              "2025-12",
              27.2
            ],
            [
              "2026-01",
              32.0
            ],
            [
              "2026-02",
              39.0
            ],
            [
              "2026-03",
              39.2
            ],
            [
              "2026-04",
              37.2
            ]
          ]
        },
        {
          "id": "nand-mlc",
          "name": "NAND MLC 512Gb급",
          "unit": "USD/chip",
          "color": "#ff9f0a",
          "quality": "공개 raw 제한 · USD 추적값",
          "points": [
            [
              "2025-04",
              2.4
            ],
            [
              "2025-05",
              2.45
            ],
            [
              "2025-06",
              2.52
            ],
            [
              "2025-07",
              2.65
            ],
            [
              "2025-08",
              2.9
            ],
            [
              "2025-09",
              3.2
            ],
            [
              "2025-10",
              3.8
            ],
            [
              "2025-11",
              4.6
            ],
            [
              "2025-12",
              5.55
            ],
            [
              "2026-01",
              6.75
            ],
            [
              "2026-02",
              8.1
            ],
            [
              "2026-03",
              9.1
            ],
            [
              "2026-04",
              10.2
            ]
          ]
        }
      ],
      "sources": [
        [
          "DDR4 16Gb $3.20 → $74.10, DDR5 16Gb $37.20 보도",
          "https://www.tomshardware.com/tech-industry/ddr4-spot-prices-fall-for-first-time-in-nearly-a-year-as-chinese-channel-inventory-clears"
        ],
        [
          "DDR4 16Gb $9.17, DDR5 16Gb $5.99 보도",
          "https://www.tomshardware.com/pc-components/ram/ddr4-costs-soar-as-manufacturers-pull-the-plug"
        ],
        [
          "DDR5 16Gb $39, NAND wafer 급등 보도",
          "https://www.tomshardware.com/tech-industry/memory-spot-prices-climbed-again-in-february-nand-wafer-costs-surge-25-percent"
        ]
      ],
      "qualityNote": "수동 입력/보간 데이터입니다. 투자 판단 전 원자료 확인이 필요합니다."
    },
    "retail": {
      "title": "차트 2 · 다나와 소비자가: DDR4 8G / DDR5 16G / SSD",
      "subtitle": "y축은 다나와 대표가를 1달러=₩1,400 고정 환산한 달러 가격입니다. 세 상품의 시작점을 맞추지 않습니다.",
      "unitMode": "price",
      "axisUnit": "USD",
      "fxBasis": "1 USD = 1400 KRW fixed conversion",
      "series": [
        {
          "id": "danawa-ddr4-8g",
          "name": "DDR4 8GB module · Danawa",
          "unit": "USD/module",
          "color": "#007aff",
          "quality": "수동 입력 · USD 환산",
          "points": [
            [
              "2025-04",
              12.86
            ],
            [
              "2025-05",
              13.21
            ],
            [
              "2025-06",
              14.29
            ],
            [
              "2025-07",
              16.07
            ],
            [
              "2025-08",
              18.57
            ],
            [
              "2025-09",
              22.86
            ],
            [
              "2025-10",
              28.93
            ],
            [
              "2025-11",
              38.57
            ],
            [
              "2025-12",
              49.29
            ],
            [
              "2026-01",
              60.71
            ],
            [
              "2026-02",
              70.0
            ],
            [
              "2026-03",
              73.57
            ],
            [
              "2026-04",
              68.57
            ]
          ]
        },
        {
          "id": "danawa-ddr5-16g",
          "name": "DDR5 16GB module · Danawa",
          "unit": "USD/module",
          "color": "#5856d6",
          "quality": "수동 입력 · USD 환산",
          "points": [
            [
              "2025-04",
              37.14
            ],
            [
              "2025-05",
              38.57
            ],
            [
              "2025-06",
              40.0
            ],
            [
              "2025-07",
              42.14
            ],
            [
              "2025-08",
              44.29
            ],
            [
              "2025-09",
              50.0
            ],
            [
              "2025-10",
              62.86
            ],
            [
              "2025-11",
              80.0
            ],
            [
              "2025-12",
              103.57
            ],
            [
              "2026-01",
              127.14
            ],
            [
              "2026-02",
              146.43
            ],
            [
              "2026-03",
              151.43
            ],
            [
              "2026-04",
              141.43
            ]
          ]
        },
        {
          "id": "danawa-ssd-1tb",
          "name": "NVMe SSD 1TB · Danawa",
          "unit": "USD/item",
          "color": "#34c759",
          "quality": "수동 입력 · USD 환산",
          "points": [
            [
              "2025-04",
              54.29
            ],
            [
              "2025-05",
              53.57
            ],
            [
              "2025-06",
              54.29
            ],
            [
              "2025-07",
              55.71
            ],
            [
              "2025-08",
              58.57
            ],
            [
              "2025-09",
              64.29
            ],
            [
              "2025-10",
              72.14
            ],
            [
              "2025-11",
              84.29
            ],
            [
              "2025-12",
              98.57
            ],
            [
              "2026-01",
              112.86
            ],
            [
              "2026-02",
              127.14
            ],
            [
              "2026-03",
              140.71
            ],
            [
              "2026-04",
              152.86
            ]
          ]
        }
      ],
      "sources": [
        [
          "다나와 RAM 카테고리",
          "https://prod.danawa.com/list/?cate=112752"
        ],
        [
          "다나와 SSD 카테고리",
          "https://prod.danawa.com/list/?cate=112760"
        ],
        [
          "소비자 RAM/SSD 가격 상승 배경 보도",
          "https://www.techradar.com/pro/is-ram-the-new-bitcoin-ddr4-memory-prices-are-rising-so-fast-some-tracker-graphs-are-running-out-of-space-and-i-fear-2026-could-well-see-a-10x-price-rise"
        ]
      ],
      "qualityNote": "수동 입력/보간 데이터입니다. 투자 판단 전 원자료 확인이 필요합니다."
    }
  },
  "generatedAt": "2026-05-23",
  "fx": {
    "mode": "fixed",
    "defaultKrwPerUsd": 1400,
    "note": "Danawa retail series are expressed in USD using a fixed 1 USD = 1,400 KRW assumption until monthly FX is added."
  }
}